{
  "analysis": {
    "max_equilibrium_relative_error": 1e-05,
    "max_normalized_displacement": 0.02,
    "regularized_stress_percentiles": [
      95.0,
      99.0
    ],
    "small_deformation": true,
    "stress_exclusion_mesh_lengths": 2.0,
    "type": "linear_static"
  },
  "card_id": "p_benchcad_000757:linear-static-probe:v1",
  "checks": [
    "mesh_quality",
    "selector_stability",
    "solver_completion",
    "force_equilibrium",
    "finite_response",
    "small_deformation",
    "regularized_von_mises",
    "normalized_compliance"
  ],
  "geometry": {
    "expected_solid_count": 1,
    "units": "mm"
  },
  "item_id": "p_benchcad_000757",
  "load": {
    "distribution": "boundary_triangle_consistent_nodal_v1",
    "kind": "surface_traction_probe",
    "traction_vector_mpa": [
      0.0,
      0.0,
      0.1
    ]
  },
  "material": {
    "model": "linear_elastic_isotropic",
    "poisson_ratio": 0.33,
    "profile_id": "probe-isotropic-70gpa-v1",
    "youngs_modulus_mpa": 70000.0
  },
  "mesh": {
    "algorithm_3d": 10,
    "element_type": "C3D10",
    "high_order_optimization": "none",
    "maximum_elements": 250000,
    "minimum_sicn": 0.02,
    "target_long_axis_divisions": 24,
    "target_short_axis_divisions": 5
  },
  "provenance": {
    "annotation_candidate_sha256": "65c39a3f52f877b48bba372d1c572cf0c8bd05dbff92df2e8dcc1b629ee2401d",
    "annotator_model": "Qwen/Qwen3.6-27B-FP8",
    "annotator_revision": "e89b16ebf1988b3d6befa7de50abc2d76f26eb09",
    "context_sha256": "f9a7aa16412dfc739da460709581e078abf038898b8a36aa9ef2ede5b6b6c9f7",
    "profile_sha256": "c45dd1b7bfa6d47d38d92e16e7898ce7573805d5969a91741c02cbc924290f88"
  },
  "qualification": {
    "card_sha256": "1173c6cc331530422e448c22e7423c6c4b5802fa99a79e9a0c8aa76479c79294",
    "evaluator_build_hash": "70f240931ada307aa2f99e03cbd11a2a68b1d5f23cbb0a14b54752e655b106c4",
    "item_id": "p_benchcad_000757",
    "promoted": true,
    "reference_step_sha256": "261dd9eca438a802edc9421b2723d6fdc413d8dc466a54b7600ff87f18983ee0",
    "result_sha256": "a0236e70611f1a325b96cdea9eca6e1cd1426aff1796a540e70255416fc120c3",
    "result_status": "probe_pass",
    "runtime_lock_sha256": "233a960dbf73c99b63642ca4d89aba0438b8428494f5f6b74a271893aeb34efd",
    "schema_version": "cadengbench-p.l3-card-qualification.v1",
    "source_probe_metrics": {
      "force_equilibrium_relative_error": 7.04160516622373e-09,
      "normalized_compliance": 0.01995581611739829,
      "normalized_max_displacement": 2.0816769752208388e-06,
      "regularized_von_mises_p95_mpa": 0.09873443827786811,
      "regularized_von_mises_p99_mpa": 0.10694057528824664,
      "stress_concentration_p95": 0.9873443827786811
    }
  },
  "scenario_family": "axial_tension",
  "schema_version": "cadengbench-p.l3-physics-card.v2",
  "selectors": {
    "fixed": {
      "axis": "z",
      "kind": "axis_extreme_planar_surfaces_v2",
      "maximum_count": 64,
      "minimum_area_fraction": 0.002,
      "minimum_count": 1,
      "normal_alignment_min": 0.98,
      "plane_tolerance_relative": 1e-06,
      "region_id": "axis:z:min",
      "side": "min"
    },
    "loaded": {
      "axis": "z",
      "kind": "axis_extreme_planar_surfaces_v2",
      "maximum_count": 64,
      "minimum_area_fraction": 0.002,
      "minimum_count": 1,
      "normal_alignment_min": 0.98,
      "plane_tolerance_relative": 1e-06,
      "region_id": "axis:z:max",
      "side": "max"
    }
  },
  "source_intent_claimed": false,
  "status": "solver_qualified"
}
