{
  "analysis": {
    "max_equilibrium_relative_error": 1e-05,
    "max_normalized_displacement": 0.02,
    "regularized_stress_percentiles": [
      95.0,
      99.0
    ],
    "small_deformation": true,
    "stress_exclusion_mesh_lengths": 2.0,
    "type": "linear_static"
  },
  "card_id": "p_benchcad_000518:linear-static-probe:v1",
  "checks": [
    "mesh_quality",
    "selector_stability",
    "solver_completion",
    "force_equilibrium",
    "finite_response",
    "small_deformation",
    "regularized_von_mises",
    "normalized_compliance"
  ],
  "geometry": {
    "expected_solid_count": 1,
    "units": "mm"
  },
  "item_id": "p_benchcad_000518",
  "load": {
    "distribution": "boundary_triangle_consistent_nodal_v1",
    "kind": "surface_traction_probe",
    "traction_vector_mpa": [
      0.1,
      0.0,
      0.0
    ]
  },
  "material": {
    "model": "linear_elastic_isotropic",
    "poisson_ratio": 0.33,
    "profile_id": "probe-isotropic-70gpa-v1",
    "youngs_modulus_mpa": 70000.0
  },
  "mesh": {
    "algorithm_3d": 10,
    "element_type": "C3D10",
    "high_order_optimization": "none",
    "maximum_elements": 250000,
    "minimum_sicn": 0.02,
    "target_long_axis_divisions": 24,
    "target_short_axis_divisions": 5
  },
  "provenance": {
    "annotation_candidate_sha256": "61fee940fefc1ccac1a72c4f278f9e1cab4c5b8a5bd0db31d859f540fe1c70d5",
    "annotator_model": "Qwen/Qwen3.6-27B-FP8",
    "annotator_revision": "e89b16ebf1988b3d6befa7de50abc2d76f26eb09",
    "context_sha256": "cd728e8a0152fd50fa6f1b42db0702955cb53d5987fb4d5fbfd38c7bce6e7bec",
    "profile_sha256": "c45dd1b7bfa6d47d38d92e16e7898ce7573805d5969a91741c02cbc924290f88"
  },
  "qualification": {
    "card_sha256": "011d615569f91c1530b35e93435216b7b806df4b48a0089ea123012fb7d3b956",
    "evaluator_build_hash": "70f240931ada307aa2f99e03cbd11a2a68b1d5f23cbb0a14b54752e655b106c4",
    "item_id": "p_benchcad_000518",
    "promoted": true,
    "reference_step_sha256": "e905d2f8db1a69173812cc806bbb1683875bb1b611de5fa27470b499784642b7",
    "result_sha256": "5b2663c532f0056e4981cc11cf8cfcd53987bf874c961a445580ec44b1a31c17",
    "result_status": "probe_pass",
    "runtime_lock_sha256": "233a960dbf73c99b63642ca4d89aba0438b8428494f5f6b74a271893aeb34efd",
    "schema_version": "cadengbench-p.l3-card-qualification.v1",
    "source_probe_metrics": {
      "force_equilibrium_relative_error": 9.303824788281475e-08,
      "normalized_compliance": 45.09086815906008,
      "normalized_max_displacement": 1.4210990835276422e-06,
      "regularized_von_mises_p95_mpa": 0.10014713167147526,
      "regularized_von_mises_p99_mpa": 0.10242051854697291,
      "stress_concentration_p95": 1.0014713167147526
    }
  },
  "scenario_family": "axial_tension",
  "schema_version": "cadengbench-p.l3-physics-card.v2",
  "selectors": {
    "fixed": {
      "axis": "x",
      "kind": "axis_extreme_planar_surfaces_v2",
      "maximum_count": 64,
      "minimum_area_fraction": 0.002,
      "minimum_count": 1,
      "normal_alignment_min": 0.98,
      "plane_tolerance_relative": 1e-06,
      "region_id": "axis:x:min",
      "side": "min"
    },
    "loaded": {
      "axis": "x",
      "kind": "axis_extreme_planar_surfaces_v2",
      "maximum_count": 64,
      "minimum_area_fraction": 0.002,
      "minimum_count": 1,
      "normal_alignment_min": 0.98,
      "plane_tolerance_relative": 1e-06,
      "region_id": "axis:x:max",
      "side": "max"
    }
  },
  "source_intent_claimed": false,
  "status": "solver_qualified"
}
